==START TEST==
CPU:
   0x00000000 0x00: eax=0x00000002 ebx=0x756e6547 ecx=0x6c65746e edx=0x49656e69
   0x00000001 0x00: eax=0x00000623 ebx=0x00000800 ecx=0x80982201 edx=0x078bfbfd
   0x00000002 0x00: eax=0x00000001 ebx=0x00000000 ecx=0x00000000 edx=0x002c307d
   0x80000000 0x00: eax=0x8000000a ebx=0x756e6547 ecx=0x6c65746e edx=0x49656e69
   0x80000001 0x00: eax=0x00000623 ebx=0x00000000 ecx=0x00000001 edx=0x2191abfd
   0x80000002 0x00: eax=0x65746e49 ebx=0x6f43206c ecx=0x69206572 edx=0x78392037
   0x80000003 0x00: eax=0x4e282078 ebx=0x6c616865 ecx=0x43206d65 edx=0x7373616c
   0x80000004 0x00: eax=0x726f4320 ebx=0x37692065 ecx=0x00000029 edx=0x00000000
   0x80000005 0x00: eax=0x01ff01ff ebx=0x01ff01ff ecx=0x40020140 edx=0x40020140
   0x80000006 0x00: eax=0x00000000 ebx=0x42004200 ecx=0x02008140 edx=0x00000000
   0x80000007 0x00: eax=0x00000000 ebx=0x00000000 ecx=0x00000000 edx=0x00000000
   0x80000008 0x00: eax=0x00003028 ebx=0x00000000 ecx=0x00000000 edx=0x00000000
   0x8000000a 0x00: eax=0x00000000 ebx=0x00000000 ecx=0x00000000 edx=0x00000000
   0xc0000000 0x00: eax=0x00000001 ebx=0x00000000 ecx=0x00000000 edx=0x002c307d
   0x40000000 0x00: eax=0x00000000 ebx=0x4b4d564b ecx=0x564b4d56 edx=0x0000004d
   0x40000001 0x00: eax=0x0100007b ebx=0x00000000 ecx=0x00000000 edx=0x00000000
==END TEST==
